{
  "$schema": "https://json-schema.org/draft/2020-12/schema",
  "title": "OpenAI Ten Proofs Ehrhart execution candidate manifest",
  "type": "object",
  "additionalProperties": false,
  "required": [
    "schema_version",
    "record_type",
    "manifest_id",
    "candidate_id",
    "tracker_issue",
    "candidate_record",
    "governing_contract",
    "raw_workflow_artifact",
    "source_authority",
    "repository_evidence",
    "controls",
    "activation",
    "claim_boundary"
  ],
  "properties": {
    "schema_version": {"const": "1.0.0"},
    "record_type": {"const": "openai_ten_proofs_ehrhart_execution_candidate_manifest"},
    "manifest_id": {"const": "MC-OTP-F-EHRHART-EXECUTION-CANDIDATE-MANIFEST-001"},
    "candidate_id": {"const": "MC-OTP-F-EHRHART-EXECUTION-CANDIDATE-001"},
    "tracker_issue": {"const": "https://github.com/grandchallenge/MATHCERT/issues/62"},
    "candidate_record": {},
    "governing_contract": {},
    "raw_workflow_artifact": {},
    "source_authority": {},
    "repository_evidence": {},
    "controls": {},
    "activation": {},
    "claim_boundary": {"type": "string"}
  }
}
